{
  "schema": "factory/goal@1",
  "id": "G-001",
  "rev": 14,
  "created_at": "2026-10-11T08:00:00.000Z",
  "updated_at": "2026-10-12T13:40:00.000Z",
  "title": "VIN decoder for inventory intake",
  "slug": "vin-decoder",
  "outcome": "Staff can type or scan a VIN at intake and the year, make, model and trim fill in automatically.",
  "success_criteria": [
    "A valid VIN fills year, make, model and trim in under 2 seconds",
    "An invalid VIN shows a clear error",
    "Decodes are cached for 30 days"
  ],
  "constraints": [
    "Use the existing vendor API key from settings"
  ],
  "priority": "P1",
  "tier": "M",
  "needs_ui": true,
  "status": "active",
  "status_reason": null,
  "pod": {
    "product": "product-manager",
    "tech_lead": "staff-engineer",
    "members": [
      "backend-engineer",
      "frontend-engineer",
      "data-engineer",
      "devops-release",
      "qa-engineer",
      "code-reviewer",
      "tech-writer"
    ]
  },
  "docs": {
    "prd": "docs/G-001-vin-decoder/prd.md",
    "spec": "docs/G-001-vin-decoder/spec.md",
    "plan": "docs/G-001-vin-decoder/plan.md",
    "design": "docs/G-001-vin-decoder/design/"
  },
  "gates": {
    "G1": "GATE-0001",
    "G2": "GATE-0002",
    "G3": "GATE-0003"
  },
  "gate_policy": {},
  "budget": {
    "limit_tokens": 15000000,
    "warn_pct": 80,
    "stop_pct": 100
  },
  "created_by": {
    "kind": "human",
    "via": "dashboard"
  },
  "epics": [
    "E-0001",
    "E-0002"
  ]
}
