{
  "schema": "factory/goal@1",
  "id": "G-003",
  "rev": 4,
  "created_at": "2026-10-12T10:00:00.000Z",
  "updated_at": "2026-10-12T13:05:00.000Z",
  "title": "Audit log for deal changes",
  "slug": "audit-log",
  "outcome": "Every change to a deal is recorded with who, when and the old and new values, and is visible on the deal.",
  "success_criteria": [
    "Field-level history on the deal page",
    "Entries cannot be edited",
    "Export history to CSV"
  ],
  "constraints": [
    "Keep 7 years of history"
  ],
  "priority": "P3",
  "tier": "M",
  "needs_ui": true,
  "status": "awaiting_g1",
  "status_reason": "PRD waiting for approval",
  "pod": {
    "product": "product-manager",
    "tech_lead": "staff-engineer",
    "members": []
  },
  "docs": {
    "prd": "docs/G-003-audit-log/prd.md",
    "spec": null,
    "plan": null,
    "design": null
  },
  "gates": {
    "G1": "GATE-0007",
    "G2": null,
    "G3": null
  },
  "gate_policy": {},
  "budget": {
    "limit_tokens": 15000000,
    "warn_pct": 80,
    "stop_pct": 100
  },
  "created_by": {
    "kind": "human",
    "via": "dashboard"
  },
  "epics": []
}
